{
 "subject": "religious-studies",
 "board": "AQA",
 "topic": "RS26-jihad",
 "topicName": "Jihad",
 "version": 1,
 "tests": [
  {
   "id": "RS26-jihad-quick-check",
   "name": "Quick Check",
   "description": "Timed check on Jihad",
   "timeLimit": 10,
   "passMark": 70,
   "questions": [
    {
     "id": "RS26-jihad-t1",
     "type": "short-answer",
     "question": "Explain the difference between greater and lesser jihad.",
     "correctAnswer": "Greater jihad is the internal, spiritual struggle every Muslim faces daily — resisting temptation, controlling anger, being patient, praying regularly and trying to become a better Muslim. Muhammad said after a battle: \"We have returned from the lesser jihad to the greater jihad.\" Lesser jihad is the external struggle, which may include armed combat to defend Islam or fight injustice. It has stric",
     "explanation": "",
     "marks": 1,
     "difficulty": 2,
     "ao": "AO1"
    }
   ]
  }
 ]
}