{
 "subject": "latin",
 "board": "Edexcel",
 "topic": "subjunctive-mood-advanced-syntax",
 "topicName": "Subjunctive Mood & Advanced Syntax",
 "version": 1,
 "tests": [
  {
   "id": "subjunctive-mood-advanced-syntax-quick-check",
   "name": "Quick Check",
   "description": "Timed check on Subjunctive Mood & Advanced Syntax",
   "timeLimit": 10,
   "passMark": 70,
   "questions": [
    {
     "id": "subjunctive-mood-advanced-syntax-t1",
     "type": "short-answer",
     "question": "Q: How does the present subjunctive differ from the indicative in the 1st and 3rd conjugations?",
     "correctAnswer": "1st conjugation: the stem vowel changes from -a- to -e- (e.g. laudem, not laudo). 3rd conjugation: the stem vowel changes to -a- (e.g. ducam, not duco). The 2nd changes -e- to -ea- (moneam), and the 4th changes -i- to -ia- (audiam).",
     "explanation": "",
     "marks": 1,
     "difficulty": 2,
     "ao": "AO1"
    },
    {
     "id": "subjunctive-mood-advanced-syntax-t2",
     "type": "short-answer",
     "question": "Q: How is the imperfect subjunctive formed?",
     "correctAnswer": "Add -re to the present infinitive (second principal part). Example: laudare + -re → laudarem (I would/might praise). The imperfect subjunctive is the same for all conjugations.",
     "explanation": "",
     "marks": 1,
     "difficulty": 2,
     "ao": "AO1"
    },
    {
     "id": "subjunctive-mood-advanced-syntax-t3",
     "type": "short-answer",
     "question": "Q: What is the difference between a purpose clause and a result clause?",
     "correctAnswer": "Purpose clause: ut/ne + subjunctive = 'in order to/not to'. Result clause: ut + subjunctive after tam/tantus/ita = 'so...that'. Purpose gives the intention; result gives the outcome.",
     "explanation": "",
     "marks": 1,
     "difficulty": 2,
     "ao": "AO1"
    }
   ]
  },
  {
   "id": "subjunctive-mood-advanced-syntax-exam-practice",
   "name": "Exam-Style Practice",
   "description": "Short-answer practice on Subjunctive Mood & Advanced Syntax",
   "timeLimit": 20,
   "passMark": 60,
   "questions": [
    {
     "id": "subjunctive-mood-advanced-syntax-t4",
     "type": "short-answer",
     "question": "Q: Translate: 'rex imperavit ut milites venirent.'",
     "correctAnswer": "The king ordered that the soldiers should come / The king ordered the soldiers to come. This is an indirect command: imperavit + ut + subjunctive (venirent).",
     "explanation": "",
     "marks": 1,
     "difficulty": 2,
     "ao": "AO1"
    },
    {
     "id": "subjunctive-mood-advanced-syntax-t5",
     "type": "short-answer",
     "question": "Q: How do you translate cum + subjunctive? Give the three possible meanings.",
     "correctAnswer": "Cum + subjunctive can mean: temporal ('when': cum veniret, vidi — when he came, I saw), causal ('since': cum laboraret, defessus est — since he was working, he was tired), concessive ('although': cum esset fortis, fugit — although he was brave, he fled).",
     "explanation": "",
     "marks": 1,
     "difficulty": 2,
     "ao": "AO1"
    },
    {
     "id": "subjunctive-mood-advanced-syntax-t6",
     "type": "short-answer",
     "question": "Q: What is an indirect question?",
     "correctAnswer": "A reported question where the verb is in the subjunctive. Example: rogat ubi puer sit (he asks where the boy is). The question word (ubi) introduces the subordinate clause with a subjunctive verb.",
     "explanation": "",
     "marks": 1,
     "difficulty": 2,
     "ao": "AO1"
    },
    {
     "id": "subjunctive-mood-advanced-syntax-t7",
     "type": "short-answer",
     "question": "Q: What is the gerundive of obligation?",
     "correctAnswer": "A construction using the gerundive (future passive participle) with a dative of agent and the verb sum to express necessity. Example: mihi parendum est (I must obey / it must be obeyed by me).",
     "explanation": "",
     "marks": 1,
     "difficulty": 2,
     "ao": "AO1"
    },
    {
     "id": "subjunctive-mood-advanced-syntax-t8",
     "type": "short-answer",
     "question": "Q: What is the difference between a real and unreal conditional sentence?",
     "correctAnswer": "Real condition: si + indicative (if it is true, it happens). Unreal condition: si + subjunctive (if it were true, it would happen — contrary to fact). Example: si possem, venirem (if I could, I would come — but I cannot).",
     "explanation": "",
     "marks": 1,
     "difficulty": 2,
     "ao": "AO1"
    }
   ]
  },
  {
   "id": "subjunctive-mood-advanced-syntax-extended",
   "name": "Extended Practice",
   "description": "Self-marked extended answers on Subjunctive Mood & Advanced Syntax",
   "timeLimit": 25,
   "passMark": 60,
   "questions": [
    {
     "id": "subjunctive-mood-advanced-syntax-t9",
     "type": "short-answer",
     "question": "Full-Mark Response Explain the main uses of the subjunctive mood in Latin subordinate clauses, giving examples of purpose, result, and cum clauses. (8 marks) <div class=\"",
     "correctAnswer": "The subjunctive mood is used in Latin to express actions that are not stated as facts but as possibilities, purposes, wishes, or subordinate ideas. In purpose clauses, ut + subjunctive expresses positive purpose ('in order to') and ne + subjunctive expresses negative purpose ('in order not to'). For example: milites venerunt ut urbem caperent (the soldiers came in order to capture the city). The subjunctive caperent shows this is the purpose of their coming. In result clauses, ut + subjunctive follows signal words such as tam, tantus, or ita in the main clause to express 'so...that'. For example: tam fortis erat Brutus ut hostes solus vinceret (Brutus was so brave that he alone conquered the enemy). The result clause describes the outcome of his bravery. In cum clauses, cum + subjunctive has three possible meanings depending on context. Temporal cum means 'when': cum venisset, omnes laeti erant (when he had come, everyone was happy). Causal cum means 'since': cum laboravisset, defessus est (since he had worked, he was tired). Concessive cum means 'although': cum esset parvus, fortiter pugnabat (although he was small, he fought bravely). In all three constructions, the subjunctive signals that the clause is subordinate and its action is dependent on the main verb. The choice of present or imperfect subjunctive follows the sequence of tenses: primary tense in the main verb takes the present subjunctive, and secondary (past) tense takes the imperfect subjunctive.",
     "explanation": "Extended answer: aim for the mark-scheme points, in order, with the command word addressed.",
     "marks": 4,
     "difficulty": 4,
     "ao": "AO2"
    }
   ]
  }
 ]
}