{
 "subject": "latin",
 "board": "OCR",
 "topic": "themes-verse-literature",
 "topicName": "Themes in Verse Literature",
 "version": 1,
 "tests": [
  {
   "id": "themes-verse-literature-quick-check",
   "name": "Quick Check",
   "description": "Timed check on Themes in Verse Literature",
   "timeLimit": 10,
   "passMark": 70,
   "questions": [
    {
     "id": "themes-verse-literature-t1",
     "type": "short-answer",
     "question": "Q: What is fatum in the Aeneid and how does it drive the plot?",
     "correctAnswer": "Fatum is destiny decreed by the gods, specifically that Aeneas will reach Italy and found the Roman race. It drives every event: Aeneas must leave Dido, he must fight in Italy, and nothing can prevent Jupiter's will.",
     "explanation": "",
     "marks": 1,
     "difficulty": 2,
     "ao": "AO1"
    },
    {
     "id": "themes-verse-literature-t2",
     "type": "short-answer",
     "question": "Q: How does Dido's story illustrate the theme of love and loss?",
     "correctAnswer": "Dido falls passionately in love with Aeneas, but his pietas demands he leave her. Her love becomes furor (destructive madness), leading to her suicide. She represents the human cost of Aeneas's destiny.",
     "explanation": "",
     "marks": 1,
     "difficulty": 2,
     "ao": "AO1"
    },
    {
     "id": "themes-verse-literature-t3",
     "type": "short-answer",
     "question": "Q: What is the significance of pietas for Aeneas's character?",
     "correctAnswer": "Aeneas is defined by his pietas — his sense of duty to the gods, his country, and his family. He is consistently called 'pius Aeneas'. Pietas demands he abandon Dido, fight Turnus, and put Rome's future above his own desires.",
     "explanation": "",
     "marks": 1,
     "difficulty": 2,
     "ao": "AO1"
    }
   ]
  },
  {
   "id": "themes-verse-literature-exam-practice",
   "name": "Exam-Style Practice",
   "description": "Short-answer practice on Themes in Verse Literature",
   "timeLimit": 20,
   "passMark": 60,
   "questions": [
    {
     "id": "themes-verse-literature-t4",
     "type": "short-answer",
     "question": "Q: How does Ovid treat the theme of power in the Metamorphoses?",
     "correctAnswer": "Ovid shows power as arbitrary and often cruel. The gods abuse their power to pursue mortals, and transformation is used as both punishment and a desperate escape. The powerful impose change on the powerless.",
     "explanation": "",
     "marks": 1,
     "difficulty": 2,
     "ao": "AO1"
    },
    {
     "id": "themes-verse-literature-t5",
     "type": "short-answer",
     "question": "Q: What is the conflict between furor and ratio in the Aeneid?",
     "correctAnswer": "Furor (wild passion) opposes ratio (reason, self-control). Dido's furor destroys her; Turnus's furor drives him to fight. Aeneas normally embodies ratio, but his killing of Turnus in rage suggests furor can overwhelm even the most disciplined hero.",
     "explanation": "",
     "marks": 1,
     "difficulty": 2,
     "ao": "AO1"
    },
    {
     "id": "themes-verse-literature-t6",
     "type": "short-answer",
     "question": "Q: How does the Aeneid show the cost of war?",
     "correctAnswer": "Both Trojans and Italians suffer: young warriors die, mothers mourn, and even the victor Aeneas loses friends. The final scene — Aeneas killing Turnus in rage — suggests war corrupts even those who fight for a just cause.",
     "explanation": "",
     "marks": 1,
     "difficulty": 2,
     "ao": "AO1"
    },
    {
     "id": "themes-verse-literature-t7",
     "type": "short-answer",
     "question": "Q: What is the significance of divine intervention in the Aeneid?",
     "correctAnswer": "Juno's hatred drives the early conflicts; Venus protects Aeneas; Jupiter decrees fate. The gods' conflicts mirror human ones, and mortals are often pawns in divine rivalries, raising questions about free will vs determinism.",
     "explanation": "",
     "marks": 1,
     "difficulty": 2,
     "ao": "AO1"
    },
    {
     "id": "themes-verse-literature-t8",
     "type": "short-answer",
     "question": "Q: How does Ovid use transformation to explore identity?",
     "correctAnswer": "Transformation changes outer form but often preserves inner consciousness: Actaeon as a stag still thinks like a man; Daphne as a laurel still feels fear. Ovid questions whether identity resides in the body or the mind.",
     "explanation": "",
     "marks": 1,
     "difficulty": 2,
     "ao": "AO1"
    }
   ]
  },
  {
   "id": "themes-verse-literature-extended",
   "name": "Extended Practice",
   "description": "Self-marked extended answers on Themes in Verse Literature",
   "timeLimit": 25,
   "passMark": 60,
   "questions": [
    {
     "id": "themes-verse-literature-t9",
     "type": "short-answer",
     "question": "Full-Mark Response Discuss how the themes of pietas and furor are in conflict in the Aeneid. Refer to specific characters and events. (8 marks) <div class=\"",
     "correctAnswer": "Pietas (duty to gods, country, and family) and furor (destructive passion or rage) are in constant tension throughout the Aeneid. Aeneas embodies this conflict: as 'pius Aeneas', his defining quality is duty — he carries his father from burning Troy, leads his people across the Mediterranean, and obeys the gods. Yet his pietas demands he abandon Dido, causing her furor — her passion becomes destructive madness, leading to her curse and suicide on the funeral pyre. Dido's furor is the antithesis of Aeneas's pietas: where he suppresses personal feeling for duty, she is consumed by passion. However, Virgil does not simply glorify pietas over furor: Dido is portrayed with deep sympathy, and her suicide raises questions about whether Aeneas's duty justifies the suffering it causes. Turnus represents a different kind of furor: the rage of a warrior defending his homeland. In the epic's final scene, Aeneas kills Turnus in a moment of furor, moved by rage at seeing Pallas's belt. The poem ends not with pietas triumphant but with furor overwhelming even the most dutiful hero. Virgil suggests the founding of Rome required both pietas and furor, and their relationship is a tragic entanglement.",
     "explanation": "Extended answer: aim for the mark-scheme points, in order, with the command word addressed.",
     "marks": 4,
     "difficulty": 4,
     "ao": "AO2"
    }
   ]
  }
 ]
}