{
 "subject": "business",
 "board": "AQA",
 "topic": "BS16-motivation",
 "topicName": "Motivation",
 "version": 1,
 "tests": [
  {
   "id": "BS16-motivation-quick-check",
   "name": "Quick Check",
   "description": "Timed check on Motivation",
   "timeLimit": 10,
   "passMark": 70,
   "questions": [
    {
     "id": "BS16-motivation-t1",
     "type": "short-answer",
     "question": "Explain the difference between financial and non-financial motivation, giving two examples of each.",
     "correctAnswer": "Financial motivation involves monetary rewards: wages (paid per hour worked), salaries (fixed annual amount), commission (percentage of sales achieved), bonuses (one-off performance payments). Non-financial motivation involves non-monetary rewards: job enrichment (more challenging work), empowerment (decision-making authority), job rotation (variety of tasks), fringe benefits like flexible working",
     "explanation": "",
     "marks": 1,
     "difficulty": 2,
     "ao": "AO1"
    },
    {
     "id": "BS16-motivation-t2",
     "type": "short-answer",
     "question": "Describe how Maslow's hierarchy of needs can help a business understand what motivates its employees.",
     "correctAnswer": "Maslow's hierarchy shows needs in order: physiological (basic pay for food/shelter) → safety (job security, safe conditions) → social (teamworking, belonging) → esteem (recognition, promotion) → self-actualisation (fulfilling potential). A business must ensure lower needs are met first - a pay rise addresses physiological needs, but once met, higher needs like recognition and empowerment become mo",
     "explanation": "",
     "marks": 1,
     "difficulty": 2,
     "ao": "AO1"
    },
    {
     "id": "BS16-motivation-t3",
     "type": "short-answer",
     "question": "Evaluate whether a business should focus more on financial rewards or non-financial methods to motivate staff.",
     "correctAnswer": "Financial rewards: attract and retain staff, meet basic needs, easily measured and compared, but can be expensive and their motivational effect fades (people adapt to higher pay). Non-financial methods: lower cost, address higher-level needs, create lasting motivation and job satisfaction, but harder to implement, vary between individuals, and won't work if basic pay is inadequate. Conclusion: an ",
     "explanation": "",
     "marks": 1,
     "difficulty": 2,
     "ao": "AO1"
    }
   ]
  },
  {
   "id": "BS16-motivation-extended",
   "name": "Extended Practice",
   "description": "Self-marked extended answers on Motivation",
   "timeLimit": 25,
   "passMark": 60,
   "questions": [
    {
     "id": "BS16-motivation-t4",
     "type": "short-answer",
     "question": "Full-Mark Response Evaluate how a call centre with high staff turnover could use both financial and non-financial methods to improve motivation and retention. <div class=\"",
     "correctAnswer": "A grade 9 response will: identify problems (repetitive work, low pay, high targets, lack of progression); financial solutions (competitive salary, attendance bonuses, performance commission); non-financial solutions (job rotation between campaigns, team competitions, empowerment to resolve customer issues without escalation, clear promotion path, social events); apply Herzberg (pay rise = hygiene factor, reduces dissatisfaction but doesn't motivate long-term); apply Maslow (once basic pay is adequate, social and esteem needs become more important); conclude: a balanced approach is needed - raise pay to competitive levels first, then implement non-financial methods (empowerment, progression, team belonging) for sustained motivation and retention.",
     "explanation": "Extended answer: aim for the mark-scheme points, in order, with the command word addressed.",
     "marks": 4,
     "difficulty": 4,
     "ao": "AO2"
    }
   ]
  }
 ]
}