{
 "subject": "pe",
 "board": "AQA",
 "topic": "PE27-arousal-inverted-u",
 "topicName": "Arousal and the Inverted-U Theory",
 "version": 1,
 "tests": [
  {
   "id": "PE27-arousal-inverted-u-quick-check",
   "name": "Quick Check",
   "description": "Timed check on Arousal and the Inverted-U Theory",
   "timeLimit": 10,
   "passMark": 70,
   "questions": [
    {
     "id": "PE27-arousal-inverted-u-t1",
     "type": "short-answer",
     "question": "Define arousal and explain how it affects sporting performance using the inverted-U theory.",
     "correctAnswer": "Arousal is a state of physical and psychological readiness and activation, ranging from deep sleep to extreme excitement. The inverted-U theory states that performance improves as arousal increases up to an optimal point, then declines with further arousal increases. At low arousal, performance is poor because the performer lacks energy and focus. At optimal arousal, performance peaks as the perfo",
     "explanation": "",
     "marks": 1,
     "difficulty": 2,
     "ao": "AO1"
    },
    {
     "id": "PE27-arousal-inverted-u-t2",
     "type": "short-answer",
     "question": "Explain why a rugby player needs a higher optimal arousal level than a snooker player.",
     "correctAnswer": "A rugby player needs higher optimal arousal because rugby involves gross skills (tackling, running) that require aggression, power and fast reactions. High arousal supports these demands by increasing adrenaline and muscle activation. A snooker player needs lower optimal arousal because snooker is a fine skill requiring precise cue control and a steady hand. High arousal would cause muscle tension",
     "explanation": "",
     "marks": 1,
     "difficulty": 2,
     "ao": "AO1"
    },
    {
     "id": "PE27-arousal-inverted-u-t3",
     "type": "short-answer",
     "question": "Describe three stress management techniques a performer can use to reduce over-arousal.",
     "correctAnswer": "Three stress management techniques: (1) Deep breathing - slow, controlled breathing reduces heart rate and muscle tension, calming the performer. (2) Mental rehearsal/visualisation - imagining successful performance creates a positive mental image, reduces anxiety and increases confidence. (3) Positive self-talk - replacing negative thoughts with encouraging statements like \"I am prepared and read",
     "explanation": "",
     "marks": 1,
     "difficulty": 2,
     "ao": "AO1"
    }
   ]
  },
  {
   "id": "PE27-arousal-inverted-u-exam-practice",
   "name": "Exam-Style Practice",
   "description": "Short-answer practice on Arousal and the Inverted-U Theory",
   "timeLimit": 20,
   "passMark": 60,
   "questions": [
    {
     "id": "PE27-arousal-inverted-u-t4",
     "type": "short-answer",
     "question": "What is the zone of optimal functioning and how does it differ from the inverted-U theory?",
     "correctAnswer": "The zone of optimal functioning (ZOF) is the individual performer's personal range of arousal levels where they perform at their best. It differs from the inverted-U theory because the inverted-U suggests a general optimal point for all performers, whereas ZOF recognises that each individual has their own optimal zone. Some performers perform best at higher arousal levels, while others perform bes",
     "explanation": "",
     "marks": 1,
     "difficulty": 2,
     "ao": "AO1"
    },
    {
     "id": "PE27-arousal-inverted-u-t5",
     "type": "short-answer",
     "question": "A gymnast is feeling very anxious before a major competition. Their hands are shaking and they feel tense. Using psychological strategies, explain how they could manage their arousal.",
     "correctAnswer": "The gymnast could: (1) Use deep breathing before their routine - breathe in for 4 counts, hold for 2, exhale for 6 - to lower their heart rate and reduce muscle tension. (2) Use mental rehearsal - visualise themselves performing the routine perfectly, which builds confidence and primes the motor programmes. (3) Use positive self-talk - replace \"I'm nervous, I might fall\" with \"I've practised this ",
     "explanation": "",
     "marks": 1,
     "difficulty": 2,
     "ao": "AO1"
    },
    {
     "id": "PE27-arousal-inverted-u-t6",
     "type": "short-answer",
     "question": "Explain how positive self-talk can be used to both increase and decrease arousal, giving sporting examples.",
     "correctAnswer": "Positive self-talk can increase arousal when a performer is under-aroused by using motivational statements like \"Let's go! I'm ready for this!\" or \"Bring the energy!\" - this is useful before contact sports or explosive events. Positive self-talk can decrease arousal when a performer is over-aroused by using calming statements like \"Stay calm and focused\" or \"I've done this before, trust my trainin",
     "explanation": "",
     "marks": 1,
     "difficulty": 2,
     "ao": "AO1"
    }
   ]
  }
 ]
}