{
 "subject": "english-literature",
 "board": "AQA",
 "topic": "S2-shakespearean-language",
 "topicName": "Shakespearean Language",
 "version": 1,
 "tests": [
  {
   "id": "S2-shakespearean-language-quick-check",
   "name": "Quick Check",
   "description": "Timed check on Shakespearean Language",
   "timeLimit": 10,
   "passMark": 70,
   "questions": [
    {
     "id": "S2-shakespearean-language-t1",
     "type": "short-answer",
     "question": "What is iambic pentameter and why does Shakespeare use it?",
     "correctAnswer": "Iambic pentameter is 10-syllable verse with alternating stressed/unstressed beats (da-DUM da-DUM). Shakespeare uses it for nobility and serious moments - it elevates language, creates rhythm, and signals importance. Breaking the rhythm shows emotional disturbance.",
     "explanation": "",
     "marks": 1,
     "difficulty": 2,
     "ao": "AO1"
    },
    {
     "id": "S2-shakespearean-language-t2",
     "type": "short-answer",
     "question": "What's the difference between a soliloquy and an aside?",
     "correctAnswer": "A soliloquy is a long speech with the character alone, revealing inner thoughts. An aside is a brief comment that other characters don't hear. Soliloquies = deep psychological insight; asides = quick revelations.",
     "explanation": "",
     "marks": 1,
     "difficulty": 2,
     "ao": "AO1"
    },
    {
     "id": "S2-shakespearean-language-t3",
     "type": "short-answer",
     "question": "What does the blood imagery represent in \"Macbeth\"?",
     "correctAnswer": "Blood represents guilt that cannot be washed away. Macbeth asks if \"Neptune's ocean\" can wash the blood, but it will \"the multitudinous seas incarnadine.\" Lady Macbeth sleepwalks, trying to wash imaginary blood. Blood stains represent permanent moral corruption.",
     "explanation": "",
     "marks": 1,
     "difficulty": 2,
     "ao": "AO1"
    }
   ]
  },
  {
   "id": "S2-shakespearean-language-extended",
   "name": "Extended Practice",
   "description": "Self-marked extended answers on Shakespearean Language",
   "timeLimit": 25,
   "passMark": 60,
   "questions": [
    {
     "id": "S2-shakespearean-language-t5",
     "type": "short-answer",
     "question": "Full-Mark Response 25 marks: \"How does Shakespeare use language to present Macbeth's psychological deterioration?\" <div class=\"",
     "correctAnswer": "Shakespeare charts Macbeth's psychological collapse through a linguistic degeneration that moves from complex argument to nihilistic fragmentation. In Act 1, Macbeth's soliloquies demonstrate sophisticated reasoning: the extended metaphor of \"vaulting ambition, which o'erleaps itself / And falls on th'other\" reveals a mind still capable of self-analysis, the equestrian imagery showing he can identify and evaluate his own flaw. By the banquet scene, language has begun to fracture — the imperative \"Thou canst not say I did it; never shake / Thy gory locks at me\" combines denial with accusation in a single sentence, the semicolon splitting a mind at war with itself. The personal pronoun \"I\" attempts assertion, but the negation \"never\" reveals desperation rather than control. In the final soliloquy, all argument has collapsed: \"Tomorrow, and tomorrow, and tomorrow\" reduces existence to mechanical repetition, the triple anaphora stripping the word of meaning through overuse. The metaphor of life as \"a walking shadow, a poor player / That struts and frets his hour upon the stage\" is doubly self-aware — Macbeth recognises both the theatricality of existence and his own reduction from protagonist to empty performer. The descent from complex metaphor to bleak monosyllables enacts the very hollowing out that Macbeth describes: language itself becomes the evidence of his psychological annihilation. Mark scheme: AO1 (4/4) — sustained argument tracking linguistic degeneration; AO2 (5/5) —",
     "explanation": "Extended answer: aim for the mark-scheme points, in order, with the command word addressed.",
     "marks": 4,
     "difficulty": 4,
     "ao": "AO2"
    }
   ]
  }
 ]
}