{
 "subject": "history",
 "board": "AQA",
 "topic": "H12-league-of-nations",
 "topicName": "The League of Nations",
 "version": 1,
 "tests": [
  {
   "id": "H12-league-of-nations-quick-check",
   "name": "Quick Check",
   "description": "Timed check on The League of Nations",
   "timeLimit": 10,
   "passMark": 70,
   "questions": [
    {
     "id": "H12-league-of-nations-t1",
     "type": "short-answer",
     "question": "Explain two weaknesses of the League of Nations. (4 marks)",
     "correctAnswer": "The League had no army of its own - it could not enforce decisions militarily and had to rely on member states to provide troops, who often refused. The unanimity rule meant that any Council member could veto action, so a single \"no\" vote could prevent the League from responding to aggression.",
     "explanation": "",
     "marks": 1,
     "difficulty": 2,
     "ao": "AO1"
    },
    {
     "id": "H12-league-of-nations-t2",
     "type": "short-answer",
     "question": "How important was America's absence from the League of Nations? (8 marks)",
     "correctAnswer": "America's absence was critically important. Without the USA, the League lacked the world's most powerful economy and military. Economic sanctions were weaker without American trade; other powers knew the League could not call on American support; and the League's moral authority was undermined. However, even with America, the League might still have struggled: the unanimity rule would still have a",
     "explanation": "",
     "marks": 1,
     "difficulty": 2,
     "ao": "AO1"
    },
    {
     "id": "H12-league-of-nations-t3",
     "type": "short-answer",
     "question": "\"The League of Nations was a complete failure.\" How far do you agree? (12 marks)",
     "correctAnswer": "The League was NOT a complete failure. In the 1920s, it successfully resolved disputes (Aaland Islands 1921, Greece-Bulgaria 1925, Upper Silesia 1921). Its humanitarian work was genuinely impressive: Nansen helped 425,000 refugees; the ILO improved working conditions; the Health Organisation combatted disease; and 200,000 slaves were freed. However, the League failed catastrophically in the 1930s:",
     "explanation": "",
     "marks": 1,
     "difficulty": 2,
     "ao": "AO1"
    }
   ]
  },
  {
   "id": "H12-league-of-nations-exam-practice",
   "name": "Exam-Style Practice",
   "description": "Short-answer practice on The League of Nations",
   "timeLimit": 20,
   "passMark": 60,
   "questions": [
    {
     "id": "H12-league-of-nations-t4",
     "type": "short-answer",
     "question": "Explain why the League was more successful in the 1920s than the 1930s. (8 marks)",
     "correctAnswer": "The League was more successful in the 1920s because: the international climate was more cooperative (Locarno Spring); the disputes involved small nations who could not defy the League; the major powers supported League decisions because it suited their interests; and the economic prosperity reduced tensions. In the 1930s, the Great Depression made nations more aggressive and self-interested; the d",
     "explanation": "",
     "marks": 1,
     "difficulty": 2,
     "ao": "AO1"
    },
    {
     "id": "H12-league-of-nations-t5",
     "type": "short-answer",
     "question": "\"The League's humanitarian work was its greatest achievement.\" How far do you agree? (16 marks)",
     "correctAnswer": "The humanitarian work was certainly impressive: the Health Organisation, ILO, Nansen's refugee work, anti-slavery campaigns, and drug control all achieved real results that outlasted the League itself. The ILO still exists today as a UN agency. However, the League's PRIMARY purpose was to prevent war through collective security - and in this it failed completely. If the League's greatest achieveme",
     "explanation": "",
     "marks": 1,
     "difficulty": 2,
     "ao": "AO1"
    }
   ]
  }
 ]
}