{
 "subject": "combined-science",
 "board": "AQA",
 "topic": "B16-reproduction-and-hormones",
 "topicName": "Reproduction And Hormones",
 "version": 1,
 "tests": [
  {
   "id": "B16-reproduction-and-hormones-quick-check",
   "name": "Quick Check",
   "description": "Timed check on Reproduction And Hormones",
   "timeLimit": 10,
   "passMark": 70,
   "questions": [
    {
     "id": "B16-reproduction-and-hormones-t1",
     "type": "short-answer",
     "question": "Name the four hormones that control the menstrual cycle. For each hormone, state where it is produced and its main function.",
     "correctAnswer": "FSH — produced by pituitary gland, causes egg maturation and stimulates oestrogen production. LH — produced by pituitary gland, triggers ovulation. Oestrogen — produced by ovaries, builds up uterus lining and inhibits FSH. Progesterone — produced by corpus luteum (ovary), maintains uterus lining and inhibits FSH and LH.",
     "explanation": "",
     "marks": 1,
     "difficulty": 2,
     "ao": "AO1"
    },
    {
     "id": "B16-reproduction-and-hormones-t2",
     "type": "short-answer",
     "question": "Explain how oestrogen and progesterone act as negative feedback controls in the menstrual cycle.",
     "correctAnswer": "Oestrogen inhibits FSH production (prevents further egg maturation when an egg is already developing). Progesterone inhibits both FSH and LH (prevents another egg from being released while the uterus lining is being maintained). This negative feedback ensures only one egg matures and is released per cycle.",
     "explanation": "",
     "marks": 1,
     "difficulty": 2,
     "ao": "AO1"
    },
    {
     "id": "B16-reproduction-and-hormones-t3",
     "type": "short-answer",
     "question": "Describe how the combined oral contraceptive pill prevents pregnancy.",
     "correctAnswer": "The combined pill contains oestrogen and progesterone. Oestrogen inhibits FSH so no egg matures in the ovaries. Progesterone also inhibits FSH and LH, preventing ovulation. Without an egg being released, pregnancy cannot occur.",
     "explanation": "",
     "marks": 1,
     "difficulty": 2,
     "ao": "AO1"
    }
   ]
  },
  {
   "id": "B16-reproduction-and-hormones-exam-practice",
   "name": "Exam-Style Practice",
   "description": "Short-answer practice on Reproduction And Hormones",
   "timeLimit": 20,
   "passMark": 60,
   "questions": [
    {
     "id": "B16-reproduction-and-hormones-t4",
     "type": "short-answer",
     "question": "Outline the steps involved in IVF treatment and explain why FSH and LH are given at the start.",
     "correctAnswer": "Steps: (1) Give FSH and LH to stimulate the ovaries to produce multiple mature eggs (superovulation). (2) Collect eggs from the ovaries. (3) Fertilise eggs with sperm in the lab. (4) Allow embryos to develop. (5) Implant 1-2 embryos into the uterus. FSH and LH are given because the woman may not be producing enough naturally to stimulate ovulation — these hormones ensure multiple eggs mature and a",
     "explanation": "",
     "marks": 1,
     "difficulty": 2,
     "ao": "AO1"
    },
    {
     "id": "B16-reproduction-and-hormones-t5",
     "type": "short-answer",
     "question": "Give two ethical issues associated with IVF treatment.",
     "correctAnswer": "Any two from: some embryos are created but not all are used/implanted (may be destroyed, raising right-to-life concerns); IVF is expensive and not equally available; multiple births carry health risks; emotional stress of failed treatments; religious objections to fertilisation outside the body.",
     "explanation": "",
     "marks": 1,
     "difficulty": 2,
     "ao": "AO1"
    }
   ]
  },
  {
   "id": "B16-reproduction-and-hormones-extended",
   "name": "Extended Practice",
   "description": "Self-marked extended answers on Reproduction And Hormones",
   "timeLimit": 25,
   "passMark": 60,
   "questions": [
    {
     "id": "B16-reproduction-and-hormones-t6",
     "type": "short-answer",
     "question": "Extended Answer 6 marks: Explain how hormones control the menstrual cycle and discuss IVF ethics. <div class=\"",
     "correctAnswer": "FSH, released by the pituitary gland, causes an egg to mature in the ovary and stimulates the ovaries to produce oestrogen. Oestrogen builds up the uterus lining, inhibits further FSH production (negative feedback), and stimulates LH release. LH, also from the pituitary gland, triggers ovulation (release of the egg) around day 14. After ovulation, progesterone maintains the uterus lining and inhibits both FSH and LH to prevent another egg maturing. If no embryo implants, progesterone falls, the uterus lining breaks down, and the cycle restarts. IVF raises ethical issues: surplus embryos may be destroyed, which some believe is unethical; it is expensive and not equally available; multiple births carry health risks; and some religious groups object to fertilisation outside the body. However, IVF gives infertile couples the chance to have a child, which is a significant benefit. Mark scheme: 1 mark — FSH causes egg maturation and stimulates oestrogen; 1 mark — oestrogen builds uterus lining and inhibits FSH; 1 mark — LH triggers ovulation; 1 mark — progesterone maintains lining and inhibits FSH/LH; 1 mark — at least one ethical issue explained; 1 mark — balanced consideration (benefit vs concern).",
     "explanation": "Extended answer: aim for the mark-scheme points, in order, with the command word addressed.",
     "marks": 6,
     "difficulty": 4,
     "ao": "AO2"
    }
   ]
  }
 ]
}