{
 "subject": "geography",
 "board": "AQA",
 "topic": "G40-water-resources",
 "topicName": "Water Resources",
 "version": 1,
 "tests": [
  {
   "id": "G40-water-resources-quick-check",
   "name": "Quick Check",
   "description": "Timed check on Water Resources",
   "timeLimit": 10,
   "passMark": 70,
   "questions": [
    {
     "id": "G40-water-resources-t1",
     "type": "short-answer",
     "question": "Explain why some areas of the world have water surplus while others have water deficit.",
     "correctAnswer": "Water surplus occurs where rainfall exceeds demand (e.g. Canada, Scandinavia - high rainfall, low population density). Water deficit occurs where demand exceeds supply (e.g. Middle East - low rainfall, high population and agricultural demand). The balance depends on physical factors (precipitation, geology, seasonality) and human factors (population density, wealth, industrialisation, agriculture)",
     "explanation": "",
     "marks": 1,
     "difficulty": 2,
     "ao": "AO1"
    },
    {
     "id": "G40-water-resources-t2",
     "type": "short-answer",
     "question": "Describe three factors that affect water consumption in different countries.",
     "correctAnswer": "Factor 1: Wealth - richer populations consume more water for swimming pools, gardens, and appliances. The USA uses 5,700 litres/person/day compared to Mali's 1,200 litres. Factor 2: Agriculture - farming accounts for 70% of global water withdrawals; irrigation-intensive countries use much more water. Factor 3: Climate - hot, dry climates increase demand for irrigation and cooling, while cooler, we",
     "explanation": "",
     "marks": 1,
     "difficulty": 2,
     "ao": "AO1"
    },
    {
     "id": "G40-water-resources-t3",
     "type": "short-answer",
     "question": "Using the Lesotho Highlands Water Project, evaluate the advantages and disadvantages of water transfer schemes.",
     "correctAnswer": "Advantages: Lesotho gains $50 million/year in revenue and hydroelectric power; South Africa receives reliable water for 6 million+ people in Gauteng; infrastructure improvements. Disadvantages: 30,000 people displaced; lost farmland; inadequate compensation; health problems from construction; reduced river flow downstream. Overall, the project benefits both countries economically but the social an",
     "explanation": "",
     "marks": 1,
     "difficulty": 2,
     "ao": "AO1"
    }
   ]
  },
  {
   "id": "G40-water-resources-exam-practice",
   "name": "Exam-Style Practice",
   "description": "Short-answer practice on Water Resources",
   "timeLimit": 20,
   "passMark": 60,
   "questions": [
    {
     "id": "G40-water-resources-t4",
     "type": "short-answer",
     "question": "Explain why desalination is not a sustainable solution to water scarcity for most countries.",
     "correctAnswer": "Desalination is energy-intensive (3-4 kWh per cubic metre), making it expensive and carbon-intensive unless powered by renewables. The brine waste produced is highly concentrated salt that damages marine ecosystems. It is only viable for wealthy coastal countries - Saudi Arabia can afford it, but many water-scarce LICs cannot. It does not address the root causes of water scarcity (overconsumption,",
     "explanation": "",
     "marks": 1,
     "difficulty": 2,
     "ao": "AO1"
    },
    {
     "id": "G40-water-resources-t5",
     "type": "short-answer",
     "question": "\"Water conservation is more effective than increasing supply.\" How far do you agree?",
     "correctAnswer": "Water conservation is more sustainable long-term because it reduces demand rather than creating new supply. Strategies like drip irrigation (saves 70%), greywater recycling (saves 30-50%), and metering (saves 15-20%) are cheaper and have fewer environmental impacts than dams or desalination. However, conservation alone may be insufficient in areas of absolute scarcity (e.g. Middle East) where supp",
     "explanation": "",
     "marks": 1,
     "difficulty": 2,
     "ao": "AO1"
    },
    {
     "id": "G40-water-resources-t6",
     "type": "short-answer",
     "question": "Describe three sustainable strategies for managing water resources.",
     "correctAnswer": "Strategy 1: Drip irrigation delivers water directly to plant roots, reducing evaporation by up to 70% compared to flood irrigation. Strategy 2: Greywater recycling reuses water from sinks and showers for irrigation and toilet flushing, reducing household consumption by 30-50%. Strategy 3: Rainwater harvesting collects rainwater from roofs for domestic and agricultural use, providing an affordable,",
     "explanation": "",
     "marks": 1,
     "difficulty": 2,
     "ao": "AO1"
    }
   ]
  }
 ]
}